library/src/hcc_detail/rocsparselt/src/spmm/Tensile/Logic/asm_full/aquavanjaram/gfx942/Equality/aquavanjaram_Cijk_Alik_Bljk_HHS_BH_Bias_FDMN_SPB_AS_SAV.yaml
- {MinimumRequiredVersion: 4.33.0}
- aquavanjaram
- gfx942
- [Device 0049, Device 0050]
    SolutionIndex: 0
    SolutionNameMin: Cijk_Alik_Bljk_HHS_BH_Bias_FDMN_SPB_AS_SAV_MT16x192x128_MI16x16x1_SN_AFEM1_AFEM8_CLR1_GRVWA8_GSU4_GSUC0_GSUWGMRR0_K1_LBSPPA256_LBSPPB128_LPA16_MIWT1_3_PLR1_SU8_SUM0_SUS256_WG16_16_1_WGM1_WGMXCC8_WGMXCCGn1
    SolutionIndex: 1
    SolutionNameMin: Cijk_Alik_Bljk_HHS_BH_Bias_FDMN_SPB_AS_SAV_MT16x128x256_MI16x16x1_SN_AFEM8_AFEM1_CLR1_GRVWA8_GSU9_GSUC0_GSUWGMRR0_K1_LBSPPA512_LBSPPB256_LPA16_MIWT1_2_PLR1_SU0_SUM0_SUS0_WG16_16_1_WGM1_WGMXCC8_WGMXCCGn1
    SolutionIndex: 2
    SolutionNameMin: Cijk_Alik_Bljk_HHS_BH_Bias_FDMN_SPB_AS_SAV_MT128x128x128_MI16x16x1_SN_AFEM1_AFEM1_CLR1_GRVWA8_GSU1_GSUC0_GSUWGMRR0_K1_LBSPPA256_LBSPPB128_LPA16_MIWT4_4_PLR1_SU8_SUM0_SUS256_WG32_8_1_WGM1_WGMXCC1_WGMXCCGn1
    SolutionIndex: 3
    SolutionNameMin: Cijk_Alik_Bljk_HHS_BH_Bias_FDMN_SPB_AS_SAV_MT128x128x128_MI16x16x1_SN_AFEM8_AFEM1_CLR1_GRVWA8_GSU1_GSUC0_GSUWGMRR0_K1_LBSPPA256_LBSPPB128_LPA16_MIWT4_4_PLR1_SU8_SUM0_SUS256_WG32_8_1_WGM1_WGMXCC1_WGMXCCGn1
    SolutionIndex: 4
    SolutionNameMin: Cijk_Alik_Bljk_HHS_BH_Bias_FDMN_SPB_AS_SAV_MT128x128x128_MI16x16x1_SN_AFEM1_AFEM1_CLR1_GRVWA8_GSU1_GSUC0_GSUWGMRR0_K1_LBSPPA256_LBSPPB128_LPA16_MIWT8_2_PLR1_SU8_SUM0_SUS256_WG16_16_1_WGM4_WGMXCC1_WGMXCCGn1
    SolutionIndex: 5
    SolutionNameMin: Cijk_Alik_Bljk_HHS_BH_Bias_FDMN_SPB_AS_SAV_MT256x256x64_MI16x16x1_SN_AFEM8_AFEM1_CLR1_GRVWA2_GSU1_GSUC0_GSUWGMRR0_K1_LBSPPA128_LBSPPB128_LPA16_MIWT8_8_PLR1_SU0_SUM0_SUS0_WG32_8_1_WGM1_WGMXCC1_WGMXCCGn1
    SolutionIndex: 6
    SolutionNameMin: Cijk_Alik_Bljk_HHS_BH_Bias_FDMN_SPB_AS_SAV_MT256x256x64_MI16x16x1_SN_AFEM1_AFEM1_CLR1_GRVWA8_GSU1_GSUC0_GSUWGMRR0_K1_LBSPPA128_LBSPPB128_LPA16_MIWT8_8_PLR1_SU8_SUM0_SUS256_WG32_8_1_WGM4_WGMXCC1_WGMXCCGn1
    SolutionIndex: 7
    SolutionNameMin: Cijk_Alik_Bljk_HHS_BH_Bias_FDMN_SPB_AS_SAV_MT256x256x64_MI16x16x1_SN_AFEM1_AFEM1_CLR1_GRVWA8_GSU1_GSUC0_GSUWGMRR0_K1_LBSPPA128_LBSPPB128_LPA16_MIWT8_8_PLR1_SU8_SUM0_SUS256_WG32_8_1_WGM4_WGMXCC8_WGMXCCGn1
    SolutionIndex: 8
    SolutionNameMin: Cijk_Alik_Bljk_HHS_BH_Bias_FDMN_SPB_AS_SAV_MT256x256x64_MI16x16x1_SN_AFEM1_AFEM8_CLR1_GRVWA8_GSU1_GSUC0_GSUWGMRR0_K1_LBSPPA128_LBSPPB128_LPA16_MIWT8_8_PLR1_SU8_SUM0_SUS256_WG32_8_1_WGM4_WGMXCC8_WGMXCCGn1
    SolutionIndex: 9
    SolutionNameMin: Cijk_Alik_Bljk_HHS_BH_Bias_FDMN_SPB_AS_SAV_MT128x512x64_MI16x16x1_SN_AFEM1_AFEM1_CLR1_GRVWA2_GSU1_GSUC0_GSUWGMRR0_K1_LBSPPA128_LBSPPB128_LPA16_MIWT8_8_PLR1_SU8_SUM0_SUS256_WG16_16_1_WGM1_WGMXCC1_WGMXCCGn1
    SolutionIndex: 10
    SolutionNameMin: Cijk_Alik_Bljk_HHS_BH_Bias_FDMN_SPB_AS_SAV_MT128x512x64_MI16x16x1_SN_AFEM1_AFEM8_CLR1_GRVWA2_GSU1_GSUC0_GSUWGMRR0_K1_LBSPPA128_LBSPPB128_LPA16_MIWT8_8_PLR1_SU8_SUM0_SUS256_WG16_16_1_WGM1_WGMXCC1_WGMXCCGn1
    SolutionIndex: 11
    SolutionNameMin: Cijk_Alik_Bljk_HHS_BH_Bias_FDMN_SPB_AS_SAV_MT128x512x64_MI16x16x1_SN_AFEM8_AFEM1_CLR1_GRVWA2_GSU1_GSUC0_GSUWGMRR0_K1_LBSPPA128_LBSPPB128_LPA16_MIWT8_8_PLR1_SU8_SUM0_SUS256_WG16_16_1_WGM4_WGMXCC1_WGMXCCGn1
    SolutionIndex: 12
    SolutionNameMin: Cijk_Alik_Bljk_HHS_BH_Bias_FDMN_SPB_AS_SAV_MT64x64x256_MI16x16x1_SN_AFEM1_AFEM1_CLR1_GRVWA8_GSU1_GSUC0_GSUWGMRR0_K1_LBSPPA512_LBSPPB256_LPA16_MIWT2_2_PLR1_SU0_SUM0_SUS0_WG32_8_1_WGM1_WGMXCC1_WGMXCCGn1
    SolutionIndex: 13
    SolutionNameMin: Cijk_Alik_Bljk_HHS_BH_Bias_FDMN_SPB_AS_SAV_MT192x256x64_MI16x16x1_SN_AFEM8_AFEM1_CLR1_GRVWA8_GSU1_GSUC0_GSUWGMRR0_K1_LBSPPA128_LBSPPB128_LPA16_MIWT12_4_PLR1_SU0_SUM0_SUS0_WG16_16_1_WGM4_WGMXCC8_WGMXCCGn1
    SolutionIndex: 14
    SolutionNameMin: Cijk_Alik_Bljk_HHS_BH_Bias_FDMN_SPB_AS_SAV_MT32x32x32_MI32x32x1_SN_LDSB0_AFC1_AFEM8_GRVWA8_GSU1_LPA8_LPB8_LPM0_MIWT1_1_PLR1_SU0_SUS0_SVW1_TLDS1_VWA1_VWB1_WG32_2_1
    SolutionIndex: 15
    SolutionNameMin: Cijk_Alik_Bljk_HHS_BH_Bias_FDMN_SPB_AS_SAV_MT32x32x32_MI32x32x1_SN_LDSB0_AFC1_AFEM8_GRVWA4_GSU1_LPA0_LPB0_LPM0_MIWT1_1_PLR1_SU0_SUS0_SVW1_TLDS0_VWA1_VWB1_WG32_2_1
    SolutionIndex: 16
    SolutionNameMin: Cijk_Alik_Bljk_HHS_BH_Bias_FDMN_SPB_AS_SAV_MT32x32x64_MI32x32x1_SN_LDSB0_AFC1_AFEM1_GRVWA8_GSU1_LPA8_LPB8_LPM0_MIWT1_1_PLR3_SU0_SUS0_SVW1_TLDS1_VWA1_VWB1_WG32_2_1
    SolutionIndex: 17
    SolutionNameMin: Cijk_Alik_Bljk_HHS_BH_Bias_FDMN_SPB_AS_SAV_MT32x32x32_MI32x32x1_SN_LDSB0_AFC1_AFEM8_GRVWA8_GSU1_LPA0_LPB0_LPM0_MIWT1_1_PLR1_SU0_SUS0_SVW1_TLDS0_VWA1_VWB1_WG32_2_1
    SolutionIndex: 18
    SolutionNameMin: Cijk_Alik_Bljk_HHS_BH_Bias_FDMN_SPB_AS_SAV_MT32x32x32_MI32x32x1_SN_LDSB0_AFC1_AFEM1_GRVWA4_GSU1_LPA8_LPB8_LPM0_MIWT1_1_PLR1_SU0_SUS0_SVW1_TLDS1_VWA1_VWB1_WG32_2_1
    SolutionIndex: 19
    SolutionNameMin: Cijk_Alik_Bljk_HHS_BH_Bias_FDMN_SPB_AS_SAV_MT32x32x64_MI32x32x1_SN_LDSB0_AFC1_AFEM8_GRVWA8_GSU1_LPA8_LPB8_LPM0_MIWT1_1_PLR3_SU4_SUS256_SVW1_TLDS1_VWA1_VWB1_WG32_2_1
    SolutionIndex: 20
    SolutionNameMin: Cijk_Alik_Bljk_HHS_BH_Bias_FDMN_SPB_AS_SAV_MT32x32x64_MI32x32x1_SN_LDSB0_AFC1_AFEM8_GRVWA8_GSU1_LPA8_LPB8_LPM0_MIWT1_1_PLR1_SU4_SUS256_SVW1_TLDS1_VWA1_VWB1_WG32_2_1
    SolutionIndex: 21
    SolutionNameMin: Cijk_Alik_Bljk_HHS_BH_Bias_FDMN_SPB_AS_SAV_MT32x32x32_MI32x32x1_SN_LDSB0_AFC1_AFEM8_GRVWA8_GSU1_LPA8_LPB8_LPM0_MIWT1_1_PLR1_SU4_SUS256_SVW1_TLDS1_VWA1_VWB1_WG32_2_1
    SolutionIndex: 22
    SolutionNameMin: Cijk_Alik_Bljk_HHS_BH_Bias_FDMN_SPB_AS_SAV_MT32x32x64_MI32x32x1_SN_LDSB0_AFC1_AFEM8_GRVWA4_GSU1_LPA8_LPB8_LPM0_MIWT1_1_PLR1_SU4_SUS256_SVW1_TLDS1_VWA1_VWB1_WG32_2_1
- - - [8, 14336, 1, 4096]
    - [0, 16.95]
  - - [8, 4096, 1, 14336]
    - [1, 17.93]
  - - [3072, 3072, 1, 10240]
    - [2, 288.07]
  - - [1536, 3072, 1, 768]
    - [4, 171.22]
  - - [17664, 3072, 1, 768]
    - [9, 246.32]
  - - [196608, 3072, 1, 768]
    - [11, 255.88]
  - - [24576, 3072, 1, 768]
    - [10, 260.89]
  - - [6144, 3072, 1, 768]
    - [6, 246.25]
  - - [98304, 3072, 1, 768]
    - [9, 261.65]
  - - [1536, 768, 1, 768]
    - [12, 93.58]
  - - [17664, 768, 1, 768]
    - [13, 198.42]
  - - [196608, 768, 1, 768]
    - [8, 239.87]
  - - [24576, 768, 1, 768]
    - [5, 228.57]
  - - [6144, 768, 1, 768]
    - [3, 169.12]
  - - [98304, 768, 1, 768]
    - [7, 233.78]
  - - [16, 16, 1, 16]
    - [14, 0.0]
  - - [16, 16, 1, 32]
    - [14, 0.0]
  - - [256, 256, 1, 16]
    - [15, 0.006]
  - - [256, 256, 1, 32]
    - [16, 0.012]
  - - [256, 256, 1, 64]
    - [17, 0.022]
  - - [256, 256, 1, 96]
    - [18, 0.036]
  - - [384, 384, 1, 24]
    - [19, 0.016]
  - - [384, 384, 1, 64]
    - [20, 0.046]
  - - [384, 384, 1, 96]
    - [21, 0.064]
  - - [384, 384, 1, 128]
    - [22, 0.086]
  - - [384, 384, 1, 256]
    - [22, 0.164]
- null
- null
- DeviceEfficiency
- Equality
